{
  "$schema": "https://json-schema.org/draft/2020-12/schema",
  "$id": "https://aegis.invalid/contracts/ScannerMutationBindingV1.json",
  "title": "ScannerMutationBindingV1",
  "type": "object",
  "additionalProperties": false,
  "properties": {
    "owner_id": {
      "type": "string",
      "minLength": 1,
      "maxLength": 128
    },
    "authorizer_id": {
      "type": "string",
      "pattern": "^[A-Za-z0-9][A-Za-z0-9_.-]{0,63}$"
    },
    "engine_digest": {
      "type": "string",
      "pattern": "^sha256:[0-9a-f]{64}$"
    },
    "registry_digest": {
      "type": "string",
      "pattern": "^sha256:[0-9a-f]{64}$"
    },
    "policy_digest": {
      "type": "string",
      "pattern": "^sha256:[0-9a-f]{64}$"
    },
    "registry_namespace_digest": {
      "type": "string",
      "pattern": "^sha256:[0-9a-f]{64}$"
    },
    "broker_binding_digest": {
      "type": "string",
      "pattern": "^sha256:[0-9a-f]{64}$"
    },
    "created_at": {
      "type": "string",
      "format": "date-time"
    }
  },
  "required": [
    "owner_id",
    "authorizer_id",
    "engine_digest",
    "registry_digest",
    "policy_digest",
    "registry_namespace_digest",
    "broker_binding_digest",
    "created_at"
  ]
}
